t 0 /NodeList/1/$ns3::Ipv4L3Protocol/Tx(1) ns3::Ipv4Header (tos 0x0 DSCP Default ECN Not-ECT ttl 64 id 0 protocol 6 offset (bytes) 0 flags [none] length: 56 10.0.1.1 > 10.0.2.2) ns3::TcpHeader (49153 > 50000 [SYN] Seq=0 Ack=0 Win=65535 ns3::TcpOptionTS(0;0) ns3::TcpOptionWinScale(6) ns3::TcpOptionSackPermitted([sack_perm]) ns3::TcpOptionEnd(EOL))
r 0.0450464 /NodeList/0/$ns3::Ipv4L3Protocol/Rx(1) ns3::Ipv4Header (tos 0x0 DSCP Default ECN Not-ECT ttl 64 id 0 protocol 6 offset (bytes) 0 flags [none] length: 56 10.0.1.1 > 10.0.2.2) ns3::TcpHeader (49153 > 50000 [SYN] Seq=0 Ack=0 Win=65535 ns3::TcpOptionTS(0;0) ns3::TcpOptionWinScale(6) ns3::TcpOptionSackPermitted([sack_perm]) ns3::TcpOptionEnd(EOL))
t 0.0450464 /NodeList/0/$ns3::Ipv4L3Protocol/Tx(2) ns3::Ipv4Header (tos 0x0 DSCP Default ECN Not-ECT ttl 63 id 0 protocol 6 offset (bytes) 0 flags [none] length: 56 10.0.1.1 > 10.0.2.2) ns3::TcpHeader (49153 > 50000 [SYN] Seq=0 Ack=0 Win=65535 ns3::TcpOptionTS(0;0) ns3::TcpOptionWinScale(6) ns3::TcpOptionSackPermitted([sack_perm]) ns3::TcpOptionEnd(EOL))
r 0.0452884 /NodeList/2/$ns3::Ipv4L3Protocol/Rx(1) ns3::Ipv4Header (tos 0x0 DSCP Default ECN Not-ECT ttl 63 id 0 protocol 6 offset (bytes) 0 flags [none] length: 56 10.0.1.1 > 10.0.2.2) ns3::TcpHeader (49153 > 50000 [SYN] Seq=0 Ack=0 Win=65535 ns3::TcpOptionTS(0;0) ns3::TcpOptionWinScale(6) ns3::TcpOptionSackPermitted([sack_perm]) ns3::TcpOptionEnd(EOL))
t 0.0452884 /NodeList/2/$ns3::Ipv4L3Protocol/Tx(1) ns3::Ipv4Header (tos 0x0 DSCP Default ECN Not-ECT ttl 64 id 0 protocol 6 offset (bytes) 0 flags [none] length: 56 10.0.2.2 > 10.0.1.1) ns3::TcpHeader (50000 > 49153 [SYN|ACK] Seq=0 Ack=1 Win=65535 ns3::TcpOptionTS(45;0) ns3::TcpOptionWinScale(6) ns3::TcpOptionSackPermitted([sack_perm]) ns3::TcpOptionEnd(EOL))
r 0.0455304 /NodeList/0/$ns3::Ipv4L3Protocol/Rx(2) ns3::Ipv4Header (tos 0x0 DSCP Default ECN Not-ECT ttl 64 id 0 protocol 6 offset (bytes) 0 flags [none] length: 56 10.0.2.2 > 10.0.1.1) ns3::TcpHeader (50000 > 49153 [SYN|ACK] Seq=0 Ack=1 Win=65535 ns3::TcpOptionTS(45;0) ns3::TcpOptionWinScale(6) ns3::TcpOptionSackPermitted([sack_perm]) ns3::TcpOptionEnd(EOL))
t 0.0455304 /NodeList/0/$ns3::Ipv4L3Protocol/Tx(1) ns3::Ipv4Header (tos 0x0 DSCP Default ECN Not-ECT ttl 63 id 0 protocol 6 offset (bytes) 0 flags [none] length: 56 10.0.2.2 > 10.0.1.1) ns3::TcpHeader (50000 > 49153 [SYN|ACK] Seq=0 Ack=1 Win=65535 ns3::TcpOptionTS(45;0) ns3::TcpOptionWinScale(6) ns3::TcpOptionSackPermitted([sack_perm]) ns3::TcpOptionEnd(EOL))
r 0.0905768 /NodeList/1/$ns3::Ipv4L3Protocol/Rx(1) ns3::Ipv4Header (tos 0x0 DSCP Default ECN Not-ECT ttl 63 id 0 protocol 6 offset (bytes) 0 flags [none] length: 56 10.0.2.2 > 10.0.1.1) ns3::TcpHeader (50000 > 49153 [SYN|ACK] Seq=0 Ack=1 Win=65535 ns3::TcpOptionTS(45;0) ns3::TcpOptionWinScale(6) ns3::TcpOptionSackPermitted([sack_perm]) ns3::TcpOptionEnd(EOL))
t 0.0905768 /NodeList/1/$ns3::Ipv4L3Protocol/Tx(1) ns3::Ipv4Header (tos 0x0 DSCP Default ECN Not-ECT ttl 64 id 1 protocol 6 offset (bytes) 0 flags [none] length: 52 10.0.1.1 > 10.0.2.2) ns3::TcpHeader (49153 > 50000 [ACK] Seq=1 Ack=1 Win=32768 ns3::TcpOptionTS(90;45) ns3::TcpOptionEnd(EOL))
t 0.0905768 /NodeList/1/$ns3::Ipv4L3Protocol/Tx(1) ns3::Ipv4Header (tos 0x0 DSCP Default ECN Not-ECT ttl 64 id 2 protocol 6 offset (bytes) 0 flags [none] length: 392 10.0.1.1 > 10.0.2.2) ns3::TcpHeader (49153 > 50000 [ACK] Seq=1 Ack=1 Win=32768 ns3::TcpOptionTS(90;45) ns3::TcpOptionEnd(EOL)) Payload (size=340)
r 0.13562 /NodeList/0/$ns3::Ipv4L3Protocol/Rx(1) ns3::Ipv4Header (tos 0x0 DSCP Default ECN Not-ECT ttl 64 id 1 protocol 6 offset (bytes) 0 flags [none] length: 52 10.0.1.1 > 10.0.2.2) ns3::TcpHeader (49153 > 50000 [ACK] Seq=1 Ack=1 Win=32768 ns3::TcpOptionTS(90;45) ns3::TcpOptionEnd(EOL))
t 0.13562 /NodeList/0/$ns3::Ipv4L3Protocol/Tx(2) ns3::Ipv4Header (tos 0x0 DSCP Default ECN Not-ECT ttl 63 id 1 protocol 6 offset (bytes) 0 flags [none] length: 52 10.0.1.1 > 10.0.2.2) ns3::TcpHeader (49153 > 50000 [ACK] Seq=1 Ack=1 Win=32768 ns3::TcpOptionTS(90;45) ns3::TcpOptionEnd(EOL))
r 0.135846 /NodeList/2/$ns3::Ipv4L3Protocol/Rx(1) ns3::Ipv4Header (tos 0x0 DSCP Default ECN Not-ECT ttl 63 id 1 protocol 6 offset (bytes) 0 flags [none] length: 52 10.0.1.1 > 10.0.2.2) ns3::TcpHeader (49153 > 50000 [ACK] Seq=1 Ack=1 Win=32768 ns3::TcpOptionTS(90;45) ns3::TcpOptionEnd(EOL))
r 0.135935 /NodeList/0/$ns3::Ipv4L3Protocol/Rx(1) ns3::Ipv4Header (tos 0x0 DSCP Default ECN Not-ECT ttl 64 id 2 protocol 6 offset (bytes) 0 flags [none] length: 392 10.0.1.1 > 10.0.2.2) ns3::TcpHeader (49153 > 50000 [ACK] Seq=1 Ack=1 Win=32768 ns3::TcpOptionTS(90;45) ns3::TcpOptionEnd(EOL)) Payload (size=340)
t 0.135935 /NodeList/0/$ns3::Ipv4L3Protocol/Tx(2) ns3::Ipv4Header (tos 0x0 DSCP Default ECN Not-ECT ttl 63 id 2 protocol 6 offset (bytes) 0 flags [none] length: 392 10.0.1.1 > 10.0.2.2) ns3::TcpHeader (49153 > 50000 [ACK] Seq=1 Ack=1 Win=32768 ns3::TcpOptionTS(90;45) ns3::TcpOptionEnd(EOL)) Payload (size=340)
r 0.137521 /NodeList/2/$ns3::Ipv4L3Protocol/Rx(1) ns3::Ipv4Header (tos 0x0 DSCP Default ECN Not-ECT ttl 63 id 2 protocol 6 offset (bytes) 0 flags [none] length: 392 10.0.1.1 > 10.0.2.2) ns3::TcpHeader (49153 > 50000 [ACK] Seq=1 Ack=1 Win=32768 ns3::TcpOptionTS(90;45) ns3::TcpOptionEnd(EOL)) Payload (size=340)
t 0.137521 /NodeList/2/$ns3::Ipv4L3Protocol/Tx(1) ns3::Ipv4Header (tos 0x0 DSCP Default ECN Not-ECT ttl 64 id 1 protocol 6 offset (bytes) 0 flags [none] length: 52 10.0.2.2 > 10.0.1.1) ns3::TcpHeader (50000 > 49153 [ACK] Seq=1 Ack=341 Win=32768 ns3::TcpOptionTS(137;90) ns3::TcpOptionEnd(EOL))
r 0.137747 /NodeList/0/$ns3::Ipv4L3Protocol/Rx(2) ns3::Ipv4Header (tos 0x0 DSCP Default ECN Not-ECT ttl 64 id 1 protocol 6 offset (bytes) 0 flags [none] length: 52 10.0.2.2 > 10.0.1.1) ns3::TcpHeader (50000 > 49153 [ACK] Seq=1 Ack=341 Win=32768 ns3::TcpOptionTS(137;90) ns3::TcpOptionEnd(EOL))
t 0.137747 /NodeList/0/$ns3::Ipv4L3Protocol/Tx(1) ns3::Ipv4Header (tos 0x0 DSCP Default ECN Not-ECT ttl 63 id 1 protocol 6 offset (bytes) 0 flags [none] length: 52 10.0.2.2 > 10.0.1.1) ns3::TcpHeader (50000 > 49153 [ACK] Seq=1 Ack=341 Win=32768 ns3::TcpOptionTS(137;90) ns3::TcpOptionEnd(EOL))
r 0.18279 /NodeList/1/$ns3::Ipv4L3Protocol/Rx(1) ns3::Ipv4Header (tos 0x0 DSCP Default ECN Not-ECT ttl 63 id 1 protocol 6 offset (bytes) 0 flags [none] length: 52 10.0.2.2 > 10.0.1.1) ns3::TcpHeader (50000 > 49153 [ACK] Seq=1 Ack=341 Win=32768 ns3::TcpOptionTS(137;90) ns3::TcpOptionEnd(EOL))
t 0.18279 /NodeList/1/$ns3::Ipv4L3Protocol/Tx(1) ns3::Ipv4Header (tos 0x0 DSCP Default ECN Not-ECT ttl 64 id 3 protocol 6 offset (bytes) 0 flags [none] length: 392 10.0.1.1 > 10.0.2.2) ns3::TcpHeader (49153 > 50000 [ACK] Seq=341 Ack=1 Win=32768 ns3::TcpOptionTS(182;137) ns3::TcpOptionEnd(EOL)) Payload (size=340)
r 0.228106 /NodeList/0/$ns3::Ipv4L3Protocol/Rx(1) ns3::Ipv4Header (tos 0x0 DSCP Default ECN Not-ECT ttl 64 id 3 protocol 6 offset (bytes) 0 flags [none] length: 392 10.0.1.1 > 10.0.2.2) ns3::TcpHeader (49153 > 50000 [ACK] Seq=341 Ack=1 Win=32768 ns3::TcpOptionTS(182;137) ns3::TcpOptionEnd(EOL)) Payload (size=340)
t 0.228106 /NodeList/0/$ns3::Ipv4L3Protocol/Tx(2) ns3::Ipv4Header (tos 0x0 DSCP Default ECN Not-ECT ttl 63 id 3 protocol 6 offset (bytes) 0 flags [none] length: 392 10.0.1.1 > 10.0.2.2) ns3::TcpHeader (49153 > 50000 [ACK] Seq=341 Ack=1 Win=32768 ns3::TcpOptionTS(182;137) ns3::TcpOptionEnd(EOL)) Payload (size=340)
r 0.229692 /NodeList/2/$ns3::Ipv4L3Protocol/Rx(1) ns3::Ipv4Header (tos 0x0 DSCP Default ECN Not-ECT ttl 63 id 3 protocol 6 offset (bytes) 0 flags [none] length: 392 10.0.1.1 > 10.0.2.2) ns3::TcpHeader (49153 > 50000 [ACK] Seq=341 Ack=1 Win=32768 ns3::TcpOptionTS(182;137) ns3::TcpOptionEnd(EOL)) Payload (size=340)
t 0.429692 /NodeList/2/$ns3::Ipv4L3Protocol/Tx(1) ns3::Ipv4Header (tos 0x0 DSCP Default ECN Not-ECT ttl 64 id 2 protocol 6 offset (bytes) 0 flags [none] length: 52 10.0.2.2 > 10.0.1.1) ns3::TcpHeader (50000 > 49153 [ACK] Seq=1 Ack=681 Win=32768 ns3::TcpOptionTS(429;182) ns3::TcpOptionEnd(EOL))
r 0.429918 /NodeList/0/$ns3::Ipv4L3Protocol/Rx(2) ns3::Ipv4Header (tos 0x0 DSCP Default ECN Not-ECT ttl 64 id 2 protocol 6 offset (bytes) 0 flags [none] length: 52 10.0.2.2 > 10.0.1.1) ns3::TcpHeader (50000 > 49153 [ACK] Seq=1 Ack=681 Win=32768 ns3::TcpOptionTS(429;182) ns3::TcpOptionEnd(EOL))
t 0.429918 /NodeList/0/$ns3::Ipv4L3Protocol/Tx(1) ns3::Ipv4Header (tos 0x0 DSCP Default ECN Not-ECT ttl 63 id 2 protocol 6 offset (bytes) 0 flags [none] length: 52 10.0.2.2 > 10.0.1.1) ns3::TcpHeader (50000 > 49153 [ACK] Seq=1 Ack=681 Win=32768 ns3::TcpOptionTS(429;182) ns3::TcpOptionEnd(EOL))
r 0.474961 /NodeList/1/$ns3::Ipv4L3Protocol/Rx(1) ns3::Ipv4Header (tos 0x0 DSCP Default ECN Not-ECT ttl 63 id 2 protocol 6 offset (bytes) 0 flags [none] length: 52 10.0.2.2 > 10.0.1.1) ns3::TcpHeader (50000 > 49153 [ACK] Seq=1 Ack=681 Win=32768 ns3::TcpOptionTS(429;182) ns3::TcpOptionEnd(EOL))
t 0.474961 /NodeList/1/$ns3::Ipv4L3Protocol/Tx(1) ns3::Ipv4Header (tos 0x0 DSCP Default ECN Not-ECT ttl 64 id 4 protocol 6 offset (bytes) 0 flags [none] length: 392 10.0.1.1 > 10.0.2.2) ns3::TcpHeader (49153 > 50000 [ACK] Seq=681 Ack=1 Win=32768 ns3::TcpOptionTS(474;429) ns3::TcpOptionEnd(EOL)) Payload (size=340)
r 0.520276 /NodeList/0/$ns3::Ipv4L3Protocol/Rx(1) ns3::Ipv4Header (tos 0x0 DSCP Default ECN Not-ECT ttl 64 id 4 protocol 6 offset (bytes) 0 flags [none] length: 392 10.0.1.1 > 10.0.2.2) ns3::TcpHeader (49153 > 50000 [ACK] Seq=681 Ack=1 Win=32768 ns3::TcpOptionTS(474;429) ns3::TcpOptionEnd(EOL)) Payload (size=340)
t 0.520276 /NodeList/0/$ns3::Ipv4L3Protocol/Tx(2) ns3::Ipv4Header (tos 0x0 DSCP Default ECN Not-ECT ttl 63 id 4 protocol 6 offset (bytes) 0 flags [none] length: 392 10.0.1.1 > 10.0.2.2) ns3::TcpHeader (49153 > 50000 [ACK] Seq=681 Ack=1 Win=32768 ns3::TcpOptionTS(474;429) ns3::TcpOptionEnd(EOL)) Payload (size=340)
r 0.521862 /NodeList/2/$ns3::Ipv4L3Protocol/Rx(1) ns3::Ipv4Header (tos 0x0 DSCP Default ECN Not-ECT ttl 63 id 4 protocol 6 offset (bytes) 0 flags [none] length: 392 10.0.1.1 > 10.0.2.2) ns3::TcpHeader (49153 > 50000 [ACK] Seq=681 Ack=1 Win=32768 ns3::TcpOptionTS(474;429) ns3::TcpOptionEnd(EOL)) Payload (size=340)
t 0.721862 /NodeList/2/$ns3::Ipv4L3Protocol/Tx(1) ns3::Ipv4Header (tos 0x0 DSCP Default ECN Not-ECT ttl 64 id 3 protocol 6 offset (bytes) 0 flags [none] length: 52 10.0.2.2 > 10.0.1.1) ns3::TcpHeader (50000 > 49153 [ACK] Seq=1 Ack=1021 Win=32768 ns3::TcpOptionTS(721;474) ns3::TcpOptionEnd(EOL))
r 0.722088 /NodeList/0/$ns3::Ipv4L3Protocol/Rx(2) ns3::Ipv4Header (tos 0x0 DSCP Default ECN Not-ECT ttl 64 id 3 protocol 6 offset (bytes) 0 flags [none] length: 52 10.0.2.2 > 10.0.1.1) ns3::TcpHeader (50000 > 49153 [ACK] Seq=1 Ack=1021 Win=32768 ns3::TcpOptionTS(721;474) ns3::TcpOptionEnd(EOL))
t 0.722088 /NodeList/0/$ns3::Ipv4L3Protocol/Tx(1) ns3::Ipv4Header (tos 0x0 DSCP Default ECN Not-ECT ttl 63 id 3 protocol 6 offset (bytes) 0 flags [none] length: 52 10.0.2.2 > 10.0.1.1) ns3::TcpHeader (50000 > 49153 [ACK] Seq=1 Ack=1021 Win=32768 ns3::TcpOptionTS(721;474) ns3::TcpOptionEnd(EOL))
r 0.767131 /NodeList/1/$ns3::Ipv4L3Protocol/Rx(1) ns3::Ipv4Header (tos 0x0 DSCP Default ECN Not-ECT ttl 63 id 3 protocol 6 offset (bytes) 0 flags [none] length: 52 10.0.2.2 > 10.0.1.1) ns3::TcpHeader (50000 > 49153 [ACK] Seq=1 Ack=1021 Win=32768 ns3::TcpOptionTS(721;474) ns3::TcpOptionEnd(EOL))
t 0.767131 /NodeList/1/$ns3::Ipv4L3Protocol/Tx(1) ns3::Ipv4Header (tos 0x0 DSCP Default ECN Not-ECT ttl 64 id 5 protocol 6 offset (bytes) 0 flags [none] length: 392 10.0.1.1 > 10.0.2.2) ns3::TcpHeader (49153 > 50000 [ACK] Seq=1021 Ack=1 Win=32768 ns3::TcpOptionTS(767;721) ns3::TcpOptionEnd(EOL)) Payload (size=340)
r 0.812446 /NodeList/0/$ns3::Ipv4L3Protocol/Rx(1) ns3::Ipv4Header (tos 0x0 DSCP Default ECN Not-ECT ttl 64 id 5 protocol 6 offset (bytes) 0 flags [none] length: 392 10.0.1.1 > 10.0.2.2) ns3::TcpHeader (49153 > 50000 [ACK] Seq=1021 Ack=1 Win=32768 ns3::TcpOptionTS(767;721) ns3::TcpOptionEnd(EOL)) Payload (size=340)
t 0.812446 /NodeList/0/$ns3::Ipv4L3Protocol/Tx(2) ns3::Ipv4Header (tos 0x0 DSCP Default ECN Not-ECT ttl 63 id 5 protocol 6 offset (bytes) 0 flags [none] length: 392 10.0.1.1 > 10.0.2.2) ns3::TcpHeader (49153 > 50000 [ACK] Seq=1021 Ack=1 Win=32768 ns3::TcpOptionTS(767;721) ns3::TcpOptionEnd(EOL)) Payload (size=340)
r 0.814032 /NodeList/2/$ns3::Ipv4L3Protocol/Rx(1) ns3::Ipv4Header (tos 0x0 DSCP Default ECN Not-ECT ttl 63 id 5 protocol 6 offset (bytes) 0 flags [none] length: 392 10.0.1.1 > 10.0.2.2) ns3::TcpHeader (49153 > 50000 [ACK] Seq=1021 Ack=1 Win=32768 ns3::TcpOptionTS(767;721) ns3::TcpOptionEnd(EOL)) Payload (size=340)
t 1.01403 /NodeList/2/$ns3::Ipv4L3Protocol/Tx(1) ns3::Ipv4Header (tos 0x0 DSCP Default ECN Not-ECT ttl 64 id 4 protocol 6 offset (bytes) 0 flags [none] length: 52 10.0.2.2 > 10.0.1.1) ns3::TcpHeader (50000 > 49153 [ACK] Seq=1 Ack=1361 Win=32768 ns3::TcpOptionTS(1014;767) ns3::TcpOptionEnd(EOL))
r 1.01426 /NodeList/0/$ns3::Ipv4L3Protocol/Rx(2) ns3::Ipv4Header (tos 0x0 DSCP Default ECN Not-ECT ttl 64 id 4 protocol 6 offset (bytes) 0 flags [none] length: 52 10.0.2.2 > 10.0.1.1) ns3::TcpHeader (50000 > 49153 [ACK] Seq=1 Ack=1361 Win=32768 ns3::TcpOptionTS(1014;767) ns3::TcpOptionEnd(EOL))
t 1.01426 /NodeList/0/$ns3::Ipv4L3Protocol/Tx(1) ns3::Ipv4Header (tos 0x0 DSCP Default ECN Not-ECT ttl 63 id 4 protocol 6 offset (bytes) 0 flags [none] length: 52 10.0.2.2 > 10.0.1.1) ns3::TcpHeader (50000 > 49153 [ACK] Seq=1 Ack=1361 Win=32768 ns3::TcpOptionTS(1014;767) ns3::TcpOptionEnd(EOL))
r 1.0593 /NodeList/1/$ns3::Ipv4L3Protocol/Rx(1) ns3::Ipv4Header (tos 0x0 DSCP Default ECN Not-ECT ttl 63 id 4 protocol 6 offset (bytes) 0 flags [none] length: 52 10.0.2.2 > 10.0.1.1) ns3::TcpHeader (50000 > 49153 [ACK] Seq=1 Ack=1361 Win=32768 ns3::TcpOptionTS(1014;767) ns3::TcpOptionEnd(EOL))
t 1.0593 /NodeList/1/$ns3::Ipv4L3Protocol/Tx(1) ns3::Ipv4Header (tos 0x0 DSCP Default ECN Not-ECT ttl 64 id 6 protocol 6 offset (bytes) 0 flags [none] length: 392 10.0.1.1 > 10.0.2.2) ns3::TcpHeader (49153 > 50000 [ACK] Seq=1361 Ack=1 Win=32768 ns3::TcpOptionTS(1059;1014) ns3::TcpOptionEnd(EOL)) Payload (size=340)
r 1.10462 /NodeList/0/$ns3::Ipv4L3Protocol/Rx(1) ns3::Ipv4Header (tos 0x0 DSCP Default ECN Not-ECT ttl 64 id 6 protocol 6 offset (bytes) 0 flags [none] length: 392 10.0.1.1 > 10.0.2.2) ns3::TcpHeader (49153 > 50000 [ACK] Seq=1361 Ack=1 Win=32768 ns3::TcpOptionTS(1059;1014) ns3::TcpOptionEnd(EOL)) Payload (size=340)
t 1.10462 /NodeList/0/$ns3::Ipv4L3Protocol/Tx(2) ns3::Ipv4Header (tos 0x0 DSCP Default ECN Not-ECT ttl 63 id 6 protocol 6 offset (bytes) 0 flags [none] length: 392 10.0.1.1 > 10.0.2.2) ns3::TcpHeader (49153 > 50000 [ACK] Seq=1361 Ack=1 Win=32768 ns3::TcpOptionTS(1059;1014) ns3::TcpOptionEnd(EOL)) Payload (size=340)
r 1.1062 /NodeList/2/$ns3::Ipv4L3Protocol/Rx(1) ns3::Ipv4Header (tos 0x0 DSCP Default ECN Not-ECT ttl 63 id 6 protocol 6 offset (bytes) 0 flags [none] length: 392 10.0.1.1 > 10.0.2.2) ns3::TcpHeader (49153 > 50000 [ACK] Seq=1361 Ack=1 Win=32768 ns3::TcpOptionTS(1059;1014) ns3::TcpOptionEnd(EOL)) Payload (size=340)
t 1.3062 /NodeList/2/$ns3::Ipv4L3Protocol/Tx(1) ns3::Ipv4Header (tos 0x0 DSCP Default ECN Not-ECT ttl 64 id 5 protocol 6 offset (bytes) 0 flags [none] length: 52 10.0.2.2 > 10.0.1.1) ns3::TcpHeader (50000 > 49153 [ACK] Seq=1 Ack=1701 Win=32768 ns3::TcpOptionTS(1306;1059) ns3::TcpOptionEnd(EOL))
r 1.30643 /NodeList/0/$ns3::Ipv4L3Protocol/Rx(2) ns3::Ipv4Header (tos 0x0 DSCP Default ECN Not-ECT ttl 64 id 5 protocol 6 offset (bytes) 0 flags [none] length: 52 10.0.2.2 > 10.0.1.1) ns3::TcpHeader (50000 > 49153 [ACK] Seq=1 Ack=1701 Win=32768 ns3::TcpOptionTS(1306;1059) ns3::TcpOptionEnd(EOL))
t 1.30643 /NodeList/0/$ns3::Ipv4L3Protocol/Tx(1) ns3::Ipv4Header (tos 0x0 DSCP Default ECN Not-ECT ttl 63 id 5 protocol 6 offset (bytes) 0 flags [none] length: 52 10.0.2.2 > 10.0.1.1) ns3::TcpHeader (50000 > 49153 [ACK] Seq=1 Ack=1701 Win=32768 ns3::TcpOptionTS(1306;1059) ns3::TcpOptionEnd(EOL))
r 1.35147 /NodeList/1/$ns3::Ipv4L3Protocol/Rx(1) ns3::Ipv4Header (tos 0x0 DSCP Default ECN Not-ECT ttl 63 id 5 protocol 6 offset (bytes) 0 flags [none] length: 52 10.0.2.2 > 10.0.1.1) ns3::TcpHeader (50000 > 49153 [ACK] Seq=1 Ack=1701 Win=32768 ns3::TcpOptionTS(1306;1059) ns3::TcpOptionEnd(EOL))
t 1.35147 /NodeList/1/$ns3::Ipv4L3Protocol/Tx(1) ns3::Ipv4Header (tos 0x0 DSCP Default ECN Not-ECT ttl 64 id 7 protocol 6 offset (bytes) 0 flags [none] length: 392 10.0.1.1 > 10.0.2.2) ns3::TcpHeader (49153 > 50000 [ACK] Seq=1701 Ack=1 Win=32768 ns3::TcpOptionTS(1351;1306) ns3::TcpOptionEnd(EOL)) Payload (size=340)
r 1.39679 /NodeList/0/$ns3::Ipv4L3Protocol/Rx(1) ns3::Ipv4Header (tos 0x0 DSCP Default ECN Not-ECT ttl 64 id 7 protocol 6 offset (bytes) 0 flags [none] length: 392 10.0.1.1 > 10.0.2.2) ns3::TcpHeader (49153 > 50000 [ACK] Seq=1701 Ack=1 Win=32768 ns3::TcpOptionTS(1351;1306) ns3::TcpOptionEnd(EOL)) Payload (size=340)
t 1.39679 /NodeList/0/$ns3::Ipv4L3Protocol/Tx(2) ns3::Ipv4Header (tos 0x0 DSCP Default ECN Not-ECT ttl 63 id 7 protocol 6 offset (bytes) 0 flags [none] length: 392 10.0.1.1 > 10.0.2.2) ns3::TcpHeader (49153 > 50000 [ACK] Seq=1701 Ack=1 Win=32768 ns3::TcpOptionTS(1351;1306) ns3::TcpOptionEnd(EOL)) Payload (size=340)
r 1.39837 /NodeList/2/$ns3::Ipv4L3Protocol/Rx(1) ns3::Ipv4Header (tos 0x0 DSCP Default ECN Not-ECT ttl 63 id 7 protocol 6 offset (bytes) 0 flags [none] length: 392 10.0.1.1 > 10.0.2.2) ns3::TcpHeader (49153 > 50000 [ACK] Seq=1701 Ack=1 Win=32768 ns3::TcpOptionTS(1351;1306) ns3::TcpOptionEnd(EOL)) Payload (size=340)
t 1.59837 /NodeList/2/$ns3::Ipv4L3Protocol/Tx(1) ns3::Ipv4Header (tos 0x0 DSCP Default ECN Not-ECT ttl 64 id 6 protocol 6 offset (bytes) 0 flags [none] length: 52 10.0.2.2 > 10.0.1.1) ns3::TcpHeader (50000 > 49153 [ACK] Seq=1 Ack=2041 Win=32768 ns3::TcpOptionTS(1598;1351) ns3::TcpOptionEnd(EOL))
r 1.5986 /NodeList/0/$ns3::Ipv4L3Protocol/Rx(2) ns3::Ipv4Header (tos 0x0 DSCP Default ECN Not-ECT ttl 64 id 6 protocol 6 offset (bytes) 0 flags [none] length: 52 10.0.2.2 > 10.0.1.1) ns3::TcpHeader (50000 > 49153 [ACK] Seq=1 Ack=2041 Win=32768 ns3::TcpOptionTS(1598;1351) ns3::TcpOptionEnd(EOL))
t 1.5986 /NodeList/0/$ns3::Ipv4L3Protocol/Tx(1) ns3::Ipv4Header (tos 0x0 DSCP Default ECN Not-ECT ttl 63 id 6 protocol 6 offset (bytes) 0 flags [none] length: 52 10.0.2.2 > 10.0.1.1) ns3::TcpHeader (50000 > 49153 [ACK] Seq=1 Ack=2041 Win=32768 ns3::TcpOptionTS(1598;1351) ns3::TcpOptionEnd(EOL))
r 1.64364 /NodeList/1/$ns3::Ipv4L3Protocol/Rx(1) ns3::Ipv4Header (tos 0x0 DSCP Default ECN Not-ECT ttl 63 id 6 protocol 6 offset (bytes) 0 flags [none] length: 52 10.0.2.2 > 10.0.1.1) ns3::TcpHeader (50000 > 49153 [ACK] Seq=1 Ack=2041 Win=32768 ns3::TcpOptionTS(1598;1351) ns3::TcpOptionEnd(EOL))
t 1.64364 /NodeList/1/$ns3::Ipv4L3Protocol/Tx(1) ns3::Ipv4Header (tos 0x0 DSCP Default ECN Not-ECT ttl 64 id 8 protocol 6 offset (bytes) 0 flags [none] length: 392 10.0.1.1 > 10.0.2.2) ns3::TcpHeader (49153 > 50000 [ACK] Seq=2041 Ack=1 Win=32768 ns3::TcpOptionTS(1643;1598) ns3::TcpOptionEnd(EOL)) Payload (size=340)
r 1.68896 /NodeList/0/$ns3::Ipv4L3Protocol/Rx(1) ns3::Ipv4Header (tos 0x0 DSCP Default ECN Not-ECT ttl 64 id 8 protocol 6 offset (bytes) 0 flags [none] length: 392 10.0.1.1 > 10.0.2.2) ns3::TcpHeader (49153 > 50000 [ACK] Seq=2041 Ack=1 Win=32768 ns3::TcpOptionTS(1643;1598) ns3::TcpOptionEnd(EOL)) Payload (size=340)
t 1.68896 /NodeList/0/$ns3::Ipv4L3Protocol/Tx(2) ns3::Ipv4Header (tos 0x0 DSCP Default ECN Not-ECT ttl 63 id 8 protocol 6 offset (bytes) 0 flags [none] length: 392 10.0.1.1 > 10.0.2.2) ns3::TcpHeader (49153 > 50000 [ACK] Seq=2041 Ack=1 Win=32768 ns3::TcpOptionTS(1643;1598) ns3::TcpOptionEnd(EOL)) Payload (size=340)
r 1.69054 /NodeList/2/$ns3::Ipv4L3Protocol/Rx(1) ns3::Ipv4Header (tos 0x0 DSCP Default ECN Not-ECT ttl 63 id 8 protocol 6 offset (bytes) 0 flags [none] length: 392 10.0.1.1 > 10.0.2.2) ns3::TcpHeader (49153 > 50000 [ACK] Seq=2041 Ack=1 Win=32768 ns3::TcpOptionTS(1643;1598) ns3::TcpOptionEnd(EOL)) Payload (size=340)
t 1.89054 /NodeList/2/$ns3::Ipv4L3Protocol/Tx(1) ns3::Ipv4Header (tos 0x0 DSCP Default ECN Not-ECT ttl 64 id 7 protocol 6 offset (bytes) 0 flags [none] length: 52 10.0.2.2 > 10.0.1.1) ns3::TcpHeader (50000 > 49153 [ACK] Seq=1 Ack=2381 Win=32768 ns3::TcpOptionTS(1890;1643) ns3::TcpOptionEnd(EOL))
r 1.89077 /NodeList/0/$ns3::Ipv4L3Protocol/Rx(2) ns3::Ipv4Header (tos 0x0 DSCP Default ECN Not-ECT ttl 64 id 7 protocol 6 offset (bytes) 0 flags [none] length: 52 10.0.2.2 > 10.0.1.1) ns3::TcpHeader (50000 > 49153 [ACK] Seq=1 Ack=2381 Win=32768 ns3::TcpOptionTS(1890;1643) ns3::TcpOptionEnd(EOL))
t 1.89077 /NodeList/0/$ns3::Ipv4L3Protocol/Tx(1) ns3::Ipv4Header (tos 0x0 DSCP Default ECN Not-ECT ttl 63 id 7 protocol 6 offset (bytes) 0 flags [none] length: 52 10.0.2.2 > 10.0.1.1) ns3::TcpHeader (50000 > 49153 [ACK] Seq=1 Ack=2381 Win=32768 ns3::TcpOptionTS(1890;1643) ns3::TcpOptionEnd(EOL))
r 1.93581 /NodeList/1/$ns3::Ipv4L3Protocol/Rx(1) ns3::Ipv4Header (tos 0x0 DSCP Default ECN Not-ECT ttl 63 id 7 protocol 6 offset (bytes) 0 flags [none] length: 52 10.0.2.2 > 10.0.1.1) ns3::TcpHeader (50000 > 49153 [ACK] Seq=1 Ack=2381 Win=32768 ns3::TcpOptionTS(1890;1643) ns3::TcpOptionEnd(EOL))
t 1.93581 /NodeList/1/$ns3::Ipv4L3Protocol/Tx(1) ns3::Ipv4Header (tos 0x0 DSCP Default ECN Not-ECT ttl 64 id 9 protocol 6 offset (bytes) 0 flags [none] length: 392 10.0.1.1 > 10.0.2.2) ns3::TcpHeader (49153 > 50000 [ACK] Seq=2381 Ack=1 Win=32768 ns3::TcpOptionTS(1935;1890) ns3::TcpOptionEnd(EOL)) Payload (size=340)
r 1.98113 /NodeList/0/$ns3::Ipv4L3Protocol/Rx(1) ns3::Ipv4Header (tos 0x0 DSCP Default ECN Not-ECT ttl 64 id 9 protocol 6 offset (bytes) 0 flags [none] length: 392 10.0.1.1 > 10.0.2.2) ns3::TcpHeader (49153 > 50000 [ACK] Seq=2381 Ack=1 Win=32768 ns3::TcpOptionTS(1935;1890) ns3::TcpOptionEnd(EOL)) Payload (size=340)
t 1.98113 /NodeList/0/$ns3::Ipv4L3Protocol/Tx(2) ns3::Ipv4Header (tos 0x0 DSCP Default ECN Not-ECT ttl 63 id 9 protocol 6 offset (bytes) 0 flags [none] length: 392 10.0.1.1 > 10.0.2.2) ns3::TcpHeader (49153 > 50000 [ACK] Seq=2381 Ack=1 Win=32768 ns3::TcpOptionTS(1935;1890) ns3::TcpOptionEnd(EOL)) Payload (size=340)
r 1.98271 /NodeList/2/$ns3::Ipv4L3Protocol/Rx(1) ns3::Ipv4Header (tos 0x0 DSCP Default ECN Not-ECT ttl 63 id 9 protocol 6 offset (bytes) 0 flags [none] length: 392 10.0.1.1 > 10.0.2.2) ns3::TcpHeader (49153 > 50000 [ACK] Seq=2381 Ack=1 Win=32768 ns3::TcpOptionTS(1935;1890) ns3::TcpOptionEnd(EOL)) Payload (size=340)
t 2.18271 /NodeList/2/$ns3::Ipv4L3Protocol/Tx(1) ns3::Ipv4Header (tos 0x0 DSCP Default ECN Not-ECT ttl 64 id 8 protocol 6 offset (bytes) 0 flags [none] length: 52 10.0.2.2 > 10.0.1.1) ns3::TcpHeader (50000 > 49153 [ACK] Seq=1 Ack=2721 Win=32768 ns3::TcpOptionTS(2182;1935) ns3::TcpOptionEnd(EOL))
r 2.18294 /NodeList/0/$ns3::Ipv4L3Protocol/Rx(2) ns3::Ipv4Header (tos 0x0 DSCP Default ECN Not-ECT ttl 64 id 8 protocol 6 offset (bytes) 0 flags [none] length: 52 10.0.2.2 > 10.0.1.1) ns3::TcpHeader (50000 > 49153 [ACK] Seq=1 Ack=2721 Win=32768 ns3::TcpOptionTS(2182;1935) ns3::TcpOptionEnd(EOL))
t 2.18294 /NodeList/0/$ns3::Ipv4L3Protocol/Tx(1) ns3::Ipv4Header (tos 0x0 DSCP Default ECN Not-ECT ttl 63 id 8 protocol 6 offset (bytes) 0 flags [none] length: 52 10.0.2.2 > 10.0.1.1) ns3::TcpHeader (50000 > 49153 [ACK] Seq=1 Ack=2721 Win=32768 ns3::TcpOptionTS(2182;1935) ns3::TcpOptionEnd(EOL))
r 2.22798 /NodeList/1/$ns3::Ipv4L3Protocol/Rx(1) ns3::Ipv4Header (tos 0x0 DSCP Default ECN Not-ECT ttl 63 id 8 protocol 6 offset (bytes) 0 flags [none] length: 52 10.0.2.2 > 10.0.1.1) ns3::TcpHeader (50000 > 49153 [ACK] Seq=1 Ack=2721 Win=32768 ns3::TcpOptionTS(2182;1935) ns3::TcpOptionEnd(EOL))
t 2.22798 /NodeList/1/$ns3::Ipv4L3Protocol/Tx(1) ns3::Ipv4Header (tos 0x0 DSCP Default ECN Not-ECT ttl 64 id 10 protocol 6 offset (bytes) 0 flags [none] length: 392 10.0.1.1 > 10.0.2.2) ns3::TcpHeader (49153 > 50000 [ACK] Seq=2721 Ack=1 Win=32768 ns3::TcpOptionTS(2227;2182) ns3::TcpOptionEnd(EOL)) Payload (size=340)
r 2.2733 /NodeList/0/$ns3::Ipv4L3Protocol/Rx(1) ns3::Ipv4Header (tos 0x0 DSCP Default ECN Not-ECT ttl 64 id 10 protocol 6 offset (bytes) 0 flags [none] length: 392 10.0.1.1 > 10.0.2.2) ns3::TcpHeader (49153 > 50000 [ACK] Seq=2721 Ack=1 Win=32768 ns3::TcpOptionTS(2227;2182) ns3::TcpOptionEnd(EOL)) Payload (size=340)
t 2.2733 /NodeList/0/$ns3::Ipv4L3Protocol/Tx(2) ns3::Ipv4Header (tos 0x0 DSCP Default ECN Not-ECT ttl 63 id 10 protocol 6 offset (bytes) 0 flags [none] length: 392 10.0.1.1 > 10.0.2.2) ns3::TcpHeader (49153 > 50000 [ACK] Seq=2721 Ack=1 Win=32768 ns3::TcpOptionTS(2227;2182) ns3::TcpOptionEnd(EOL)) Payload (size=340)
r 2.27488 /NodeList/2/$ns3::Ipv4L3Protocol/Rx(1) ns3::Ipv4Header (tos 0x0 DSCP Default ECN Not-ECT ttl 63 id 10 protocol 6 offset (bytes) 0 flags [none] length: 392 10.0.1.1 > 10.0.2.2) ns3::TcpHeader (49153 > 50000 [ACK] Seq=2721 Ack=1 Win=32768 ns3::TcpOptionTS(2227;2182) ns3::TcpOptionEnd(EOL)) Payload (size=340)
t 2.47488 /NodeList/2/$ns3::Ipv4L3Protocol/Tx(1) ns3::Ipv4Header (tos 0x0 DSCP Default ECN Not-ECT ttl 64 id 9 protocol 6 offset (bytes) 0 flags [none] length: 52 10.0.2.2 > 10.0.1.1) ns3::TcpHeader (50000 > 49153 [ACK] Seq=1 Ack=3061 Win=32768 ns3::TcpOptionTS(2474;2227) ns3::TcpOptionEnd(EOL))
r 2.47511 /NodeList/0/$ns3::Ipv4L3Protocol/Rx(2) ns3::Ipv4Header (tos 0x0 DSCP Default ECN Not-ECT ttl 64 id 9 protocol 6 offset (bytes) 0 flags [none] length: 52 10.0.2.2 > 10.0.1.1) ns3::TcpHeader (50000 > 49153 [ACK] Seq=1 Ack=3061 Win=32768 ns3::TcpOptionTS(2474;2227) ns3::TcpOptionEnd(EOL))
t 2.47511 /NodeList/0/$ns3::Ipv4L3Protocol/Tx(1) ns3::Ipv4Header (tos 0x0 DSCP Default ECN Not-ECT ttl 63 id 9 protocol 6 offset (bytes) 0 flags [none] length: 52 10.0.2.2 > 10.0.1.1) ns3::TcpHeader (50000 > 49153 [ACK] Seq=1 Ack=3061 Win=32768 ns3::TcpOptionTS(2474;2227) ns3::TcpOptionEnd(EOL))
r 2.52015 /NodeList/1/$ns3::Ipv4L3Protocol/Rx(1) ns3::Ipv4Header (tos 0x0 DSCP Default ECN Not-ECT ttl 63 id 9 protocol 6 offset (bytes) 0 flags [none] length: 52 10.0.2.2 > 10.0.1.1) ns3::TcpHeader (50000 > 49153 [ACK] Seq=1 Ack=3061 Win=32768 ns3::TcpOptionTS(2474;2227) ns3::TcpOptionEnd(EOL))
t 2.52015 /NodeList/1/$ns3::Ipv4L3Protocol/Tx(1) ns3::Ipv4Header (tos 0x0 DSCP Default ECN Not-ECT ttl 64 id 11 protocol 6 offset (bytes) 0 flags [none] length: 392 10.0.1.1 > 10.0.2.2) ns3::TcpHeader (49153 > 50000 [ACK] Seq=3061 Ack=1 Win=32768 ns3::TcpOptionTS(2520;2474) ns3::TcpOptionEnd(EOL)) Payload (size=340)
r 2.56547 /NodeList/0/$ns3::Ipv4L3Protocol/Rx(1) ns3::Ipv4Header (tos 0x0 DSCP Default ECN Not-ECT ttl 64 id 11 protocol 6 offset (bytes) 0 flags [none] length: 392 10.0.1.1 > 10.0.2.2) ns3::TcpHeader (49153 > 50000 [ACK] Seq=3061 Ack=1 Win=32768 ns3::TcpOptionTS(2520;2474) ns3::TcpOptionEnd(EOL)) Payload (size=340)
t 2.56547 /NodeList/0/$ns3::Ipv4L3Protocol/Tx(2) ns3::Ipv4Header (tos 0x0 DSCP Default ECN Not-ECT ttl 63 id 11 protocol 6 offset (bytes) 0 flags [none] length: 392 10.0.1.1 > 10.0.2.2) ns3::TcpHeader (49153 > 50000 [ACK] Seq=3061 Ack=1 Win=32768 ns3::TcpOptionTS(2520;2474) ns3::TcpOptionEnd(EOL)) Payload (size=340)
r 2.56705 /NodeList/2/$ns3::Ipv4L3Protocol/Rx(1) ns3::Ipv4Header (tos 0x0 DSCP Default ECN Not-ECT ttl 63 id 11 protocol 6 offset (bytes) 0 flags [none] length: 392 10.0.1.1 > 10.0.2.2) ns3::TcpHeader (49153 > 50000 [ACK] Seq=3061 Ack=1 Win=32768 ns3::TcpOptionTS(2520;2474) ns3::TcpOptionEnd(EOL)) Payload (size=340)
t 2.76705 /NodeList/2/$ns3::Ipv4L3Protocol/Tx(1) ns3::Ipv4Header (tos 0x0 DSCP Default ECN Not-ECT ttl 64 id 10 protocol 6 offset (bytes) 0 flags [none] length: 52 10.0.2.2 > 10.0.1.1) ns3::TcpHeader (50000 > 49153 [ACK] Seq=1 Ack=3401 Win=32768 ns3::TcpOptionTS(2767;2520) ns3::TcpOptionEnd(EOL))
r 2.76728 /NodeList/0/$ns3::Ipv4L3Protocol/Rx(2) ns3::Ipv4Header (tos 0x0 DSCP Default ECN Not-ECT ttl 64 id 10 protocol 6 offset (bytes) 0 flags [none] length: 52 10.0.2.2 > 10.0.1.1) ns3::TcpHeader (50000 > 49153 [ACK] Seq=1 Ack=3401 Win=32768 ns3::TcpOptionTS(2767;2520) ns3::TcpOptionEnd(EOL))
t 2.76728 /NodeList/0/$ns3::Ipv4L3Protocol/Tx(1) ns3::Ipv4Header (tos 0x0 DSCP Default ECN Not-ECT ttl 63 id 10 protocol 6 offset (bytes) 0 flags [none] length: 52 10.0.2.2 > 10.0.1.1) ns3::TcpHeader (50000 > 49153 [ACK] Seq=1 Ack=3401 Win=32768 ns3::TcpOptionTS(2767;2520) ns3::TcpOptionEnd(EOL))
r 2.81232 /NodeList/1/$ns3::Ipv4L3Protocol/Rx(1) ns3::Ipv4Header (tos 0x0 DSCP Default ECN Not-ECT ttl 63 id 10 protocol 6 offset (bytes) 0 flags [none] length: 52 10.0.2.2 > 10.0.1.1) ns3::TcpHeader (50000 > 49153 [ACK] Seq=1 Ack=3401 Win=32768 ns3::TcpOptionTS(2767;2520) ns3::TcpOptionEnd(EOL))
t 2.81232 /NodeList/1/$ns3::Ipv4L3Protocol/Tx(1) ns3::Ipv4Header (tos 0x0 DSCP Default ECN Not-ECT ttl 64 id 12 protocol 6 offset (bytes) 0 flags [none] length: 392 10.0.1.1 > 10.0.2.2) ns3::TcpHeader (49153 > 50000 [ACK] Seq=3401 Ack=1 Win=32768 ns3::TcpOptionTS(2812;2767) ns3::TcpOptionEnd(EOL)) Payload (size=340)
r 2.85764 /NodeList/0/$ns3::Ipv4L3Protocol/Rx(1) ns3::Ipv4Header (tos 0x0 DSCP Default ECN Not-ECT ttl 64 id 12 protocol 6 offset (bytes) 0 flags [none] length: 392 10.0.1.1 > 10.0.2.2) ns3::TcpHeader (49153 > 50000 [ACK] Seq=3401 Ack=1 Win=32768 ns3::TcpOptionTS(2812;2767) ns3::TcpOptionEnd(EOL)) Payload (size=340)
t 2.85764 /NodeList/0/$ns3::Ipv4L3Protocol/Tx(2) ns3::Ipv4Header (tos 0x0 DSCP Default ECN Not-ECT ttl 63 id 12 protocol 6 offset (bytes) 0 flags [none] length: 392 10.0.1.1 > 10.0.2.2) ns3::TcpHeader (49153 > 50000 [ACK] Seq=3401 Ack=1 Win=32768 ns3::TcpOptionTS(2812;2767) ns3::TcpOptionEnd(EOL)) Payload (size=340)
r 2.85923 /NodeList/2/$ns3::Ipv4L3Protocol/Rx(1) ns3::Ipv4Header (tos 0x0 DSCP Default ECN Not-ECT ttl 63 id 12 protocol 6 offset (bytes) 0 flags [none] length: 392 10.0.1.1 > 10.0.2.2) ns3::TcpHeader (49153 > 50000 [ACK] Seq=3401 Ack=1 Win=32768 ns3::TcpOptionTS(2812;2767) ns3::TcpOptionEnd(EOL)) Payload (size=340)
t 3.05923 /NodeList/2/$ns3::Ipv4L3Protocol/Tx(1) ns3::Ipv4Header (tos 0x0 DSCP Default ECN Not-ECT ttl 64 id 11 protocol 6 offset (bytes) 0 flags [none] length: 52 10.0.2.2 > 10.0.1.1) ns3::TcpHeader (50000 > 49153 [ACK] Seq=1 Ack=3741 Win=32768 ns3::TcpOptionTS(3059;2812) ns3::TcpOptionEnd(EOL))
r 3.05945 /NodeList/0/$ns3::Ipv4L3Protocol/Rx(2) ns3::Ipv4Header (tos 0x0 DSCP Default ECN Not-ECT ttl 64 id 11 protocol 6 offset (bytes) 0 flags [none] length: 52 10.0.2.2 > 10.0.1.1) ns3::TcpHeader (50000 > 49153 [ACK] Seq=1 Ack=3741 Win=32768 ns3::TcpOptionTS(3059;2812) ns3::TcpOptionEnd(EOL))
t 3.05945 /NodeList/0/$ns3::Ipv4L3Protocol/Tx(1) ns3::Ipv4Header (tos 0x0 DSCP Default ECN Not-ECT ttl 63 id 11 protocol 6 offset (bytes) 0 flags [none] length: 52 10.0.2.2 > 10.0.1.1) ns3::TcpHeader (50000 > 49153 [ACK] Seq=1 Ack=3741 Win=32768 ns3::TcpOptionTS(3059;2812) ns3::TcpOptionEnd(EOL))
r 3.10449 /NodeList/1/$ns3::Ipv4L3Protocol/Rx(1) ns3::Ipv4Header (tos 0x0 DSCP Default ECN Not-ECT ttl 63 id 11 protocol 6 offset (bytes) 0 flags [none] length: 52 10.0.2.2 > 10.0.1.1) ns3::TcpHeader (50000 > 49153 [ACK] Seq=1 Ack=3741 Win=32768 ns3::TcpOptionTS(3059;2812) ns3::TcpOptionEnd(EOL))
t 3.10449 /NodeList/1/$ns3::Ipv4L3Protocol/Tx(1) ns3::Ipv4Header (tos 0x0 DSCP Default ECN Not-ECT ttl 64 id 13 protocol 6 offset (bytes) 0 flags [none] length: 392 10.0.1.1 > 10.0.2.2) ns3::TcpHeader (49153 > 50000 [ACK] Seq=3741 Ack=1 Win=32768 ns3::TcpOptionTS(3104;3059) ns3::TcpOptionEnd(EOL)) Payload (size=340)
r 3.14981 /NodeList/0/$ns3::Ipv4L3Protocol/Rx(1) ns3::Ipv4Header (tos 0x0 DSCP Default ECN Not-ECT ttl 64 id 13 protocol 6 offset (bytes) 0 flags [none] length: 392 10.0.1.1 > 10.0.2.2) ns3::TcpHeader (49153 > 50000 [ACK] Seq=3741 Ack=1 Win=32768 ns3::TcpOptionTS(3104;3059) ns3::TcpOptionEnd(EOL)) Payload (size=340)
t 3.14981 /NodeList/0/$ns3::Ipv4L3Protocol/Tx(2) ns3::Ipv4Header (tos 0x0 DSCP Default ECN Not-ECT ttl 63 id 13 protocol 6 offset (bytes) 0 flags [none] length: 392 10.0.1.1 > 10.0.2.2) ns3::TcpHeader (49153 > 50000 [ACK] Seq=3741 Ack=1 Win=32768 ns3::TcpOptionTS(3104;3059) ns3::TcpOptionEnd(EOL)) Payload (size=340)
r 3.1514 /NodeList/2/$ns3::Ipv4L3Protocol/Rx(1) ns3::Ipv4Header (tos 0x0 DSCP Default ECN Not-ECT ttl 63 id 13 protocol 6 offset (bytes) 0 flags [none] length: 392 10.0.1.1 > 10.0.2.2) ns3::TcpHeader (49153 > 50000 [ACK] Seq=3741 Ack=1 Win=32768 ns3::TcpOptionTS(3104;3059) ns3::TcpOptionEnd(EOL)) Payload (size=340)
t 3.3514 /NodeList/2/$ns3::Ipv4L3Protocol/Tx(1) ns3::Ipv4Header (tos 0x0 DSCP Default ECN Not-ECT ttl 64 id 12 protocol 6 offset (bytes) 0 flags [none] length: 52 10.0.2.2 > 10.0.1.1) ns3::TcpHeader (50000 > 49153 [ACK] Seq=1 Ack=4081 Win=32768 ns3::TcpOptionTS(3351;3104) ns3::TcpOptionEnd(EOL))
r 3.35162 /NodeList/0/$ns3::Ipv4L3Protocol/Rx(2) ns3::Ipv4Header (tos 0x0 DSCP Default ECN Not-ECT ttl 64 id 12 protocol 6 offset (bytes) 0 flags [none] length: 52 10.0.2.2 > 10.0.1.1) ns3::TcpHeader (50000 > 49153 [ACK] Seq=1 Ack=4081 Win=32768 ns3::TcpOptionTS(3351;3104) ns3::TcpOptionEnd(EOL))
t 3.35162 /NodeList/0/$ns3::Ipv4L3Protocol/Tx(1) ns3::Ipv4Header (tos 0x0 DSCP Default ECN Not-ECT ttl 63 id 12 protocol 6 offset (bytes) 0 flags [none] length: 52 10.0.2.2 > 10.0.1.1) ns3::TcpHeader (50000 > 49153 [ACK] Seq=1 Ack=4081 Win=32768 ns3::TcpOptionTS(3351;3104) ns3::TcpOptionEnd(EOL))
r 3.39666 /NodeList/1/$ns3::Ipv4L3Protocol/Rx(1) ns3::Ipv4Header (tos 0x0 DSCP Default ECN Not-ECT ttl 63 id 12 protocol 6 offset (bytes) 0 flags [none] length: 52 10.0.2.2 > 10.0.1.1) ns3::TcpHeader (50000 > 49153 [ACK] Seq=1 Ack=4081 Win=32768 ns3::TcpOptionTS(3351;3104) ns3::TcpOptionEnd(EOL))
t 3.39666 /NodeList/1/$ns3::Ipv4L3Protocol/Tx(1) ns3::Ipv4Header (tos 0x0 DSCP Default ECN Not-ECT ttl 64 id 14 protocol 6 offset (bytes) 0 flags [none] length: 392 10.0.1.1 > 10.0.2.2) ns3::TcpHeader (49153 > 50000 [ACK] Seq=4081 Ack=1 Win=32768 ns3::TcpOptionTS(3396;3351) ns3::TcpOptionEnd(EOL)) Payload (size=340)
r 3.44198 /NodeList/0/$ns3::Ipv4L3Protocol/Rx(1) ns3::Ipv4Header (tos 0x0 DSCP Default ECN Not-ECT ttl 64 id 14 protocol 6 offset (bytes) 0 flags [none] length: 392 10.0.1.1 > 10.0.2.2) ns3::TcpHeader (49153 > 50000 [ACK] Seq=4081 Ack=1 Win=32768 ns3::TcpOptionTS(3396;3351) ns3::TcpOptionEnd(EOL)) Payload (size=340)
t 3.44198 /NodeList/0/$ns3::Ipv4L3Protocol/Tx(2) ns3::Ipv4Header (tos 0x0 DSCP Default ECN Not-ECT ttl 63 id 14 protocol 6 offset (bytes) 0 flags [none] length: 392 10.0.1.1 > 10.0.2.2) ns3::TcpHeader (49153 > 50000 [ACK] Seq=4081 Ack=1 Win=32768 ns3::TcpOptionTS(3396;3351) ns3::TcpOptionEnd(EOL)) Payload (size=340)
r 3.44357 /NodeList/2/$ns3::Ipv4L3Protocol/Rx(1) ns3::Ipv4Header (tos 0x0 DSCP Default ECN Not-ECT ttl 63 id 14 protocol 6 offset (bytes) 0 flags [none] length: 392 10.0.1.1 > 10.0.2.2) ns3::TcpHeader (49153 > 50000 [ACK] Seq=4081 Ack=1 Win=32768 ns3::TcpOptionTS(3396;3351) ns3::TcpOptionEnd(EOL)) Payload (size=340)
t 3.64357 /NodeList/2/$ns3::Ipv4L3Protocol/Tx(1) ns3::Ipv4Header (tos 0x0 DSCP Default ECN Not-ECT ttl 64 id 13 protocol 6 offset (bytes) 0 flags [none] length: 52 10.0.2.2 > 10.0.1.1) ns3::TcpHeader (50000 > 49153 [ACK] Seq=1 Ack=4421 Win=32768 ns3::TcpOptionTS(3643;3396) ns3::TcpOptionEnd(EOL))
r 3.64379 /NodeList/0/$ns3::Ipv4L3Protocol/Rx(2) ns3::Ipv4Header (tos 0x0 DSCP Default ECN Not-ECT ttl 64 id 13 protocol 6 offset (bytes) 0 flags [none] length: 52 10.0.2.2 > 10.0.1.1) ns3::TcpHeader (50000 > 49153 [ACK] Seq=1 Ack=4421 Win=32768 ns3::TcpOptionTS(3643;3396) ns3::TcpOptionEnd(EOL))
t 3.64379 /NodeList/0/$ns3::Ipv4L3Protocol/Tx(1) ns3::Ipv4Header (tos 0x0 DSCP Default ECN Not-ECT ttl 63 id 13 protocol 6 offset (bytes) 0 flags [none] length: 52 10.0.2.2 > 10.0.1.1) ns3::TcpHeader (50000 > 49153 [ACK] Seq=1 Ack=4421 Win=32768 ns3::TcpOptionTS(3643;3396) ns3::TcpOptionEnd(EOL))
r 3.68884 /NodeList/1/$ns3::Ipv4L3Protocol/Rx(1) ns3::Ipv4Header (tos 0x0 DSCP Default ECN Not-ECT ttl 63 id 13 protocol 6 offset (bytes) 0 flags [none] length: 52 10.0.2.2 > 10.0.1.1) ns3::TcpHeader (50000 > 49153 [ACK] Seq=1 Ack=4421 Win=32768 ns3::TcpOptionTS(3643;3396) ns3::TcpOptionEnd(EOL))
t 3.68884 /NodeList/1/$ns3::Ipv4L3Protocol/Tx(1) ns3::Ipv4Header (tos 0x0 DSCP Default ECN Not-ECT ttl 64 id 15 protocol 6 offset (bytes) 0 flags [none] length: 392 10.0.1.1 > 10.0.2.2) ns3::TcpHeader (49153 > 50000 [ACK] Seq=4421 Ack=1 Win=32768 ns3::TcpOptionTS(3688;3643) ns3::TcpOptionEnd(EOL)) Payload (size=340)
r 3.73415 /NodeList/0/$ns3::Ipv4L3Protocol/Rx(1) ns3::Ipv4Header (tos 0x0 DSCP Default ECN Not-ECT ttl 64 id 15 protocol 6 offset (bytes) 0 flags [none] length: 392 10.0.1.1 > 10.0.2.2) ns3::TcpHeader (49153 > 50000 [ACK] Seq=4421 Ack=1 Win=32768 ns3::TcpOptionTS(3688;3643) ns3::TcpOptionEnd(EOL)) Payload (size=340)
t 3.73415 /NodeList/0/$ns3::Ipv4L3Protocol/Tx(2) ns3::Ipv4Header (tos 0x0 DSCP Default ECN Not-ECT ttl 63 id 15 protocol 6 offset (bytes) 0 flags [none] length: 392 10.0.1.1 > 10.0.2.2) ns3::TcpHeader (49153 > 50000 [ACK] Seq=4421 Ack=1 Win=32768 ns3::TcpOptionTS(3688;3643) ns3::TcpOptionEnd(EOL)) Payload (size=340)
r 3.73574 /NodeList/2/$ns3::Ipv4L3Protocol/Rx(1) ns3::Ipv4Header (tos 0x0 DSCP Default ECN Not-ECT ttl 63 id 15 protocol 6 offset (bytes) 0 flags [none] length: 392 10.0.1.1 > 10.0.2.2) ns3::TcpHeader (49153 > 50000 [ACK] Seq=4421 Ack=1 Win=32768 ns3::TcpOptionTS(3688;3643) ns3::TcpOptionEnd(EOL)) Payload (size=340)
t 3.93574 /NodeList/2/$ns3::Ipv4L3Protocol/Tx(1) ns3::Ipv4Header (tos 0x0 DSCP Default ECN Not-ECT ttl 64 id 14 protocol 6 offset (bytes) 0 flags [none] length: 52 10.0.2.2 > 10.0.1.1) ns3::TcpHeader (50000 > 49153 [ACK] Seq=1 Ack=4761 Win=32768 ns3::TcpOptionTS(3935;3688) ns3::TcpOptionEnd(EOL))
r 3.93596 /NodeList/0/$ns3::Ipv4L3Protocol/Rx(2) ns3::Ipv4Header (tos 0x0 DSCP Default ECN Not-ECT ttl 64 id 14 protocol 6 offset (bytes) 0 flags [none] length: 52 10.0.2.2 > 10.0.1.1) ns3::TcpHeader (50000 > 49153 [ACK] Seq=1 Ack=4761 Win=32768 ns3::TcpOptionTS(3935;3688) ns3::TcpOptionEnd(EOL))
t 3.93596 /NodeList/0/$ns3::Ipv4L3Protocol/Tx(1) ns3::Ipv4Header (tos 0x0 DSCP Default ECN Not-ECT ttl 63 id 14 protocol 6 offset (bytes) 0 flags [none] length: 52 10.0.2.2 > 10.0.1.1) ns3::TcpHeader (50000 > 49153 [ACK] Seq=1 Ack=4761 Win=32768 ns3::TcpOptionTS(3935;3688) ns3::TcpOptionEnd(EOL))
r 3.98101 /NodeList/1/$ns3::Ipv4L3Protocol/Rx(1) ns3::Ipv4Header (tos 0x0 DSCP Default ECN Not-ECT ttl 63 id 14 protocol 6 offset (bytes) 0 flags [none] length: 52 10.0.2.2 > 10.0.1.1) ns3::TcpHeader (50000 > 49153 [ACK] Seq=1 Ack=4761 Win=32768 ns3::TcpOptionTS(3935;3688) ns3::TcpOptionEnd(EOL))
t 3.98101 /NodeList/1/$ns3::Ipv4L3Protocol/Tx(1) ns3::Ipv4Header (tos 0x0 DSCP Default ECN Not-ECT ttl 64 id 16 protocol 6 offset (bytes) 0 flags [none] length: 392 10.0.1.1 > 10.0.2.2) ns3::TcpHeader (49153 > 50000 [ACK] Seq=4761 Ack=1 Win=32768 ns3::TcpOptionTS(3981;3935) ns3::TcpOptionEnd(EOL)) Payload (size=340)
r 4.02632 /NodeList/0/$ns3::Ipv4L3Protocol/Rx(1) ns3::Ipv4Header (tos 0x0 DSCP Default ECN Not-ECT ttl 64 id 16 protocol 6 offset (bytes) 0 flags [none] length: 392 10.0.1.1 > 10.0.2.2) ns3::TcpHeader (49153 > 50000 [ACK] Seq=4761 Ack=1 Win=32768 ns3::TcpOptionTS(3981;3935) ns3::TcpOptionEnd(EOL)) Payload (size=340)
t 4.02632 /NodeList/0/$ns3::Ipv4L3Protocol/Tx(2) ns3::Ipv4Header (tos 0x0 DSCP Default ECN Not-ECT ttl 63 id 16 protocol 6 offset (bytes) 0 flags [none] length: 392 10.0.1.1 > 10.0.2.2) ns3::TcpHeader (49153 > 50000 [ACK] Seq=4761 Ack=1 Win=32768 ns3::TcpOptionTS(3981;3935) ns3::TcpOptionEnd(EOL)) Payload (size=340)
r 4.02791 /NodeList/2/$ns3::Ipv4L3Protocol/Rx(1) ns3::Ipv4Header (tos 0x0 DSCP Default ECN Not-ECT ttl 63 id 16 protocol 6 offset (bytes) 0 flags [none] length: 392 10.0.1.1 > 10.0.2.2) ns3::TcpHeader (49153 > 50000 [ACK] Seq=4761 Ack=1 Win=32768 ns3::TcpOptionTS(3981;3935) ns3::TcpOptionEnd(EOL)) Payload (size=340)
t 4.22791 /NodeList/2/$ns3::Ipv4L3Protocol/Tx(1) ns3::Ipv4Header (tos 0x0 DSCP Default ECN Not-ECT ttl 64 id 15 protocol 6 offset (bytes) 0 flags [none] length: 52 10.0.2.2 > 10.0.1.1) ns3::TcpHeader (50000 > 49153 [ACK] Seq=1 Ack=5101 Win=32768 ns3::TcpOptionTS(4227;3981) ns3::TcpOptionEnd(EOL))
